text,jr_score,summary
"Oligodendrocytes, responsible for axon ensheathment, are critical for central nervous system (CNS) development, function, and diseases. OLIG2 is an important transcription factor (TF) that acts during oligodendrocyte development and performs distinct functions at different stages. Previous studies have shown that lncRNAs (long non-coding RNAs; > 200 bp) have important functions during oligodendrocyte development, but their roles have not been systematically characterized and their regulation is not yet clear.

We performed an integrated study of genome-wide OLIG2 binding and the epigenetic modification status of both coding and non-coding genes during three stages of oligodendrocyte differentiation in vivo: neural stem cells (NSCs), oligodendrocyte progenitor cells (OPCs), and newly formed oligodendrocytes (NFOs). We found that 613 lncRNAs have OLIG2 binding sites and are expressed in at least one cell type, which can potentially be activated or repressed by OLIG2. Forty-eight of them have increased expression in oligodendrocyte lineage cells. Predicting lncRNA functions by using a “guilt-by-association” approach revealed that the functions of these 48 lncRNAs were enriched in “oligodendrocyte development and differentiation.” Additionally, bivalent genes are known to play essential roles during embryonic stem cell differentiation. We identified bivalent genes in NSCs, OPCs, and NFOs and found that some bivalent genes bound by OLIG2 are dynamically regulated during oligodendrocyte development. Importantly, we unveiled a previously unknown mechanism that, in addition to transcriptional regulation via DNA binding, OLIG2 could self-regulate through the 3′ UTR of its own mRNA.

Our studies have revealed the missing links in the mechanisms regulating oligodendrocyte development at the transcriptional level and after transcription. The results of our research have improved the understanding of fundamental cell fate decisions during oligodendrocyte lineage formation, which can enable insights into demyelination diseases and regenerative medicine.

The mammalian central nervous system (CNS) is made up of diverse cell types that belong to distinct functional lineages and are developmentally specified by transcription factors (TFs) [ 1 , 2 ]. Oligodendrocyte progenitor cells (OPCs) differentiate from neural stem cells (NSCs) and can give rise to mature oligodendrocytes responsible for myelination. Axon ensheathment is critical for CNS development, function, and diseases such as multiple sclerosis (MS), leukodystrophies, stroke, and spinal cord or brain injury [ 3 – 7 ]. However, the molecular mechanisms regulating oligodendrocyte formation and differentiation are not yet fully understood.

A number of stage-specific TFs have been reported to control oligodendrocyte specification, differentiation, and myelination [ 8 ]. The basic-helix-loop-helix (bHLH) transcription factor oligodendrocyte TF 1/2 (OLIG1/2) are master regulators of oligodendrocyte development [ 9 – 12 ]. Olig1 and Olig2 have potentially redundant but also non-overlapping roles in the proliferation and differentiation of neural progenitors [ 13 ]. Previous studies reported that ablation of Olig1 had an impact on the later stage of oligodendrocyte development [ 12 , 14 ] and knocking out Olig2 in mice led to the failure of oligodendroglial lineage generation [ 12 ]. Specific deletion of Olig2 in OPCs caused hypomyelination by reducing oligodendrocyte differentiation, while the ablation of Olig2 in immature oligodendrocyte induced maturation of oligodendrocytes, myelination, and remyelination in mice [ 15 ]. Moreover, overexpression of Olig2 in NSCs promoted the generation of OPCs and mature oligodendrocytes both in vitro and in vivo [ 11 , 16 ].

Previous studies have shown that OLIG2 may activate or repress gene expression directly or cooperatively with other factors [ 17 – 19 ]. OLIG2 regulates many important protein-coding genes during oligodendrocyte formation (e.g., Sox10 ) [ 20 ]. Additionally, previous studies from our group and others have demonstrated that OLIG2 also controls many long non-coding RNAs (lncRNAs) [ 21 , 22 ]. lncRNAs (> 200 bp) play crucial roles in transcriptional regulation during various biological processes including embryonic stem cells (ESCs) differentiation, neurogenesis, and cancer [ 23 , 24 ].

It is of critical importance to investigate lncRNAs, because only less than 2% of the genome is associated with protein-coding genes, and a large number of disease-causing mutations reside in the non-coding regions [ 25 ]. Several studies have revealed that lncRNAs are transcribed in developmental- and tissue-specific manners and regulate cell fate determination [ 26 – 30 ]. For example, the depletion of dozens of lincRNAs (long intergenic noncoding RNAs) causes ESCs to exit the pluripotent state or increase lineage commitment [ 31 ]. Also, multiple mouse knockout models have proven that lncRNAs are required for brain development in vivo [ 28 ]. Also, lncRNAs are regulated by cell-type-specific TFs, such as the pluripotency TFs SOX2, OCT4, and NANOG in ESCs, or the RE1 silencing TF (REST) during neuronal differentiation [ 31 – 33 ]. In our previous studies, we found that lnc-OPC was highly expressed in OPCs and repressed by OLIG2 [ 21 , 34 ]. The deletion of lnc-OPC significantly reduced OPCs formation and affected the expression of genes associated with differentiation from NSCs to OPCs [ 21 ]. LncRNAs often bind to ubiquitous regulatory proteins such as chromatin modification complexes to guide them to specific locations in the genome, controlling a number of downstream genes to define cell-type-specific expression programs. Such a mechanism resolves the paradox that a small repertoire of chromatin-modifying complexes, which often have RNA-binding domains but little DNA sequence specificity, can establish complex epigenetic states across different cell types arising throughout development [ 35 , 36 ]. For example, He et al. have demonstrated that lncOL1 and SUZ12/PRC2 could form a complex to promote oligodendrocyte differentiation [ 22 ].

Evidence shows that dynamic epigenetic modification plays an essential role during the process of oligodendrocyte differentiation [ 37 – 39 ]. In particular, bivalent domains containing both repressive H3K27m3 (K27) and active H3K4m3 (K4) marks reportedly play important roles in pluripotency and cell differentiation [ 40 ]. In ESCs, genes with bivalent domains in the promoter (bivalent genes) were silent yet poised for activation upon differentiation [ 40 ]. However, little is known about the function of such bivalent genes during the process of oligodendrocyte formation and differentiation or about how they are regulated.

In addition to regulation at transcription level, regulation after transcription involves RNA processing (such as alternative splicing, capping, and polyadenylation), RNA editing, mRNA stability, and translation. Previous studies have demonstrated that certain genes could regulate their expression through protein interaction with their own mRNAs. For example, TDP-43 and huntingtin protein (HTT) in the CNS [ 41 , 42 ]. However, it is not yet known whether OLIG2 has such a mechanism of regulation.

In previous studies, we identified the cell-type-specific gene markers by analyzing NSCs, OPCs, and newly formed oligodendrocytes (NFOs) transcriptomes [ 43 ]. To further investigate the mechanisms of regulation during oligodendrocyte differentiation, we have performed ChIP-Seq (chromatin immunoprecipitation sequencing) experiments by in vivo purifying oligodendrocyte lineage cells of different stages of oligodendrocyte development using mouse models. We integrated ChIP-Seq data for OLIG2 and epigenetic status together with RNA-Seq (RNA sequencing) data from NSCs, OPCs, and NFOs. In the current study, we have identified the protein-coding and lncRNA genes bound by OLIG2 in vivo in NSCs, OPCs, and NFOs. Motif analysis showed that binding motifs for other TFs were also found in the OLIG2 binding region, likely cooperating with OLIG2 in regulating oligodendrocyte development. We found that lncRNAs can be either activated or repressed by OLIG2, potentially functioning during oligodendrocyte formation and differentiation. These OLIG2-bound lncRNAs were functionally enriched in ‘oligodendrocyte differentiation’ based on “guilt-by-association” analysis. Based on ChIP-Seq analysis of H3K27m3 (K27) and H3K4m3 (K4) marks, we identified the bivalent genes in NSC, OPC, and NFO stages. These bivalent genes were dynamically regulated during oligodendrocyte differentiation and some of them were bound by OLIG2. Intriguingly, we found AU-rich elements (AREs) in the 3′ UTR (untranslated region) of Olig2 mRNAs and demonstrated for the first time that OLIG2 can act not only as a transcriptional factor by binding to genomic DNA but also be involved in the regulation of Olig2 after transcription via the 3′ UTR of its own mRNA.

The above analysis implies that OLIG2 binding did not always lead to gene activation but also to gene repression, which raises a question as to whether this could due to the recruitment of other TFs. We obtained DEGs with OLIG2 called peaks in OPCs or NFOs and analyzed the TF motifs using Homer known motifs analysis among these peaks (Fig. 2 g). For example, ASCL1 and SMAD3 motifs were highly enriched in both OPCs vs. NSCs up-regulated genes and NFOs vs. OPCs down-regulated genes; SMAD2 motifs were highly enriched in NFOs vs. OPCs down-regulated genes; MYC motifs was enriched in OPCs vs. NSCs and NFOs vs. OPCs downregulated genes. In addition to these TF motifs, we also found that CTCF motifs were enriched in downregulated genes in OPCs vs. NSCs and NFOs vs. OPCs; Jun-AP1 and USF2 motifs are enriched in NFOs vs. OPCs upregulated genes. Motifs for SOX family proteins were enriched in both OPCs vs. NSCs up- and downregulated genes and NFOs vs. OPCs upregulated genes. Because of fewer upregulated genes in NFOs vs. OPCs with OLIG2 called peaks, the statistics of TF motifs among these genes is less significant compared to other stages. RNA-Seq data showed that these TFs were indeed expressed in NSCs, OPCs, and NFOs (Fig. 2 h).

The genes in cluster 7 (101 lncRNAs) were expressed at lower levels in NSCs and higher levels in OPCs and NFOs. A total of 39 genes (including lnc-OPC , group 1) were annotated with OLIG2 called peaks only in NSCs but not in OPCs and NFOs, and nine lncRNAs (group 2) had OLIG2 called peaks in OPCs and NFOs but not in NSCs (Fig. 3 b). We predicted the potential roles of these lncRNAs using a “guilt-by-association” analysis. First, we computed the gene expression Pearson correlations between each lncRNA and protein-coding genes and then ranked protein-coding genes by their correlation coefficients [ 45 ]. Significantly enriched gene sets were identified using the Gene Set Enrichment Analysis (GSEA) [ 46 , 47 ]. The functions of these 48 lncRNAs were enriched for the term “oligodendrocyte differentiation” (Fig. 3 b). For example, AC140285.1 has lower expression in NSCs but higher expression in OPCs and NFOs according to RNA-Seq and qPCR validation (Fig. 3 c and Additional file 4 : Fig S1) from NSCs, OPCs, and NFOs. Moreover, OLIG2 ChIP-Seq results showed that this gene is annotated with OLIG2 called peaks in OPCs and NFOs but not in NSCs (Fig. 3 c). These correlation results of OLIG2 ChIP-Seq with RNA-Seq in NSCs, OPCs, and NFOs suggested that AC140285.1 might be activated by OLIG2 in OPCs and NFOs.

We also constructed a state-of-the-art regulation database using WashU EpiGenome Browser [ 49 ] that provides an interactive, searchable interface for querying and exploring OLIG2 and epigenetic regulation across the stages during oligodendrocyte development. The database is a CGI application and is publicly available to the research community ( http://jiaqianwulab.org/OLIG2chip/oligodendrocyte_chip.html ).

To identify associations between epigenetic modification and gene expression, we annotated total peaks identified (see Methods). We annotated the peaks within 2 kb upstream and downstream of the TSS of each gene. The annotated peaks were classified as “K4 only,” “K27 only,” “bivalent” (including both overlapping H3K4me3 and H3K27me3 marks), and other classes. We identified 36.1%, 32.3%, and 24.4% of genes associated with “K4 only” in NSCs, OPCs, and NFOs, respectively, and 3.5%, 5.4%, and 3.8% of genes associated with “K27 only” in NSCs, OPCs. and NFOs, respectively. In contrast, only 4.7%, 2.8%, and 1.5% of genes contained bivalent domains in NSCs, OPCs, and NFOs, respectively (Fig. 4 c, Additional file 5 : Table S4). Histone methylation states were highly correlated to gene expression (Fig. 4 d–f), as genes containing only H3K4me3 or H3K27me3 marks showed higher and lower expression levels, respectively, in all cell types, and genes containing bivalent domains showed intermediate expression. Additionally, we also examined some other oligodendrocyte-related genes using the histone ChIP-Seq and RNA-Seq results (e.g., Nkx2-2 , Olig2 , Yy1 , and Gpr17 ) (Fig. 4 g and Additional file 6 : Fig S2). For example, Olig2 plays important role in the initial specification of oligodendrocyte lineage [ 12 , 50 ], and Nkx2-2 , Yy1 , and Gpr17 are subsequently required for the generation of mature oligodendrocytes [ 51 – 53 ].

Next, we investigated the dynamics of regulation of bivalent genes during the transition of NSCs to OPCs and NFOs (Fig. 5 c). A total of 1984 bivalent genes were analyzed in NSCs. Among these, 23.1% (459) had “K4 only” marks in OPCs and NFOs. For example, we found that Sox10 and Zfp488 were bivalent genes in NSCs and had “K4 only” marks in OPCs and NFOs (Fig. 5 d, e). The expression levels of these genes were low in NSCs but high in OPCs and NFOs (Fig. 5 d, e). It has been found that Sox10 may induce NSCs to enter the oligodendrocyte lineage [ 56 ] and Zfp488 may promote oligodendrocyte differentiation in adult subventricular zone (SVZ) neural stem/progenitor cells (NSPCs) [ 57 ].

Given that Olig2 likely associated with its own mRNA, we sought to examine the effect that overexpressing Olig2 could have on the expression of a ZsGreen1 reporter under the control of the 3′ UTR of Olig2 . To do this, ZsGreen1 reporter constructs with or without Olig2 3′ UTR were created (Additional file 8 : Fig S3). The pcDNA3.1 mRuby plasmid was used as an internal control for the normalization of transfection efficiency. In addition to the pcDNA3.1 mRuby vector, ZsGreen1 reporter constructs were co-transfected with pCMV-Sport 6- Olig2 vector or empty vector pCMV-Sport 6 into 293FT cells at equal molar ratios respectively. Median Fluorescent Intensity (MFI) of ZsGreen1 and mRuby were measured by flow cytometry. Considering transfection efficiency variation, the MFI of ZsGreen1 signal was normalized by dividing the MFI of mRuby in each replicate (n = 6) (Fig. 6 e). Flow cytometry results indicated the normalized MFI from ZsGreen1 was similar to that from ZsGreen1- Olig2 3′ UTR when co-transfected with the empty control vector pCMV-Sport 6. However, the normalized MFI from ZsGreen1 was upregulated in cells with co-transfection of the pCMV-Sport 6- Olig2 vector, possibly due to the activation effect of OLIG2 overexpression. The expression of ZsGreen1 construct could be regulated by OLIG2 or by other molecules regulated by OLIG2 in 293FT cells. Importantly, the inclusion of Olig2 3′ UTR in the ZsGreen1 reporter significantly inhibited the normalized MFI from ZsGreen1 induced by OLIG2 overexpression, making the normalized MFI comparable to that in cells without OLIG2 overexpression. This indicated that the addition of the Olig2 3′ UTR to the C1 end of the ZsGreen1 reporter construct led to a significant reduction in ZsGreen1 protein in the Olig2 -overexpressed cells compared with the ZsGreen1 construct without the 3′ UTR of Olig2 (Fig. 6 f); thus, OLIG2 protein inhibited ZsGreen1 reporter gene expression controlled by the Olig2 3′ UTR.

Furthermore, as the hypothesis is that OLIG2 protein can inhibit its expression by binding to the Olig2 3′ UTR, we examined if overexpressing Olig2 3′ UTR can influence OLIG2 expression, leading to the changes in the endogenous protein level of OLIG2 in NSCs. As such, we performed nucleofection of the NSCs with ZsGreen1 reporter constructs with or without Olig2 3′ UTR. Two days after nucleofection, cells were harvested for Western blot analysis for the endogenous protein levels of OLIG2 and GAPDH. GAPDH acted as an internal control and was used to normalize the amount of protein lysate loaded for Western blot. The signals from Western blot were quantified with ImageJ for Western blot densitometry analysis. The densitometry values of OLIG2 were normalized by dividing that of GAPDH. As shown in Fig. 6 g, the normalized protein level of OLIG2 was significantly higher in cells transfected with the ZsGreen1- Olig2 3′ UTR vector than that transfected with ZsGreen1 vector, suggesting the expression of endogenous OLIG2 protein can be influenced by Olig2 3′ UTR, possibly due to its competitively inhibitory effect on the endogenous Olig2 mRNA for OLIG2 protein interaction.

Taken together, these results suggest that OLIG2 self-regulates at the transcriptional step (Fig. 6 b) and after transcription through the 3′ UTR of its own mRNA (Fig. 6 d–f).

Oligodendrocyte development is a complex biological process encompassing multiple stages. Previous studies have indicated that Olig2 plays essential roles in neural progenitor proliferation and differentiation through direct regulation of gene expression or cooperation with other TFs and cofactors [ 58 – 61 ]. Many of the protein coding target genes that function in oligodendrocyte differentiation have been reported but few of the involved lncRNAs are known. In our study, we found that lncRNAs regulated by Olig2 are functionally enriched during oligodendrocyte differentiation. Furthermore, bivalent genes are evidently important in pluripotent stem cell self-renewal and differentiation. Herein, we have characterized the dynamics of bivalent genes during oligodendrocyte differentiation and shown that some bivalent genes may be regulated by Olig2 . Although many previous studies of Olig2 focused on the process of transcription, little is known about its role in regulation after transcription. Interestingly, our experiments showed that OLIG2 not only regulates its own transcription, but is also involved in regulation after transcription via the 3′ UTR of its own mRNA.

lncRNAs play important functional roles during oligodendrocyte formation and differentiation, as our study and others have previously demonstrated [ 21 , 22 ]. The pioneering studies of Mercer et al. used custom-designed microarrays to show that a number of known lncRNAs exhibit differential expression during oligodendrocyte lineage specification, providing early evidence for lncRNAs in NSCs fate decisions and oligodendrocyte lineage maturation [ 62 ]. However, incomplete annotation of lncRNAs at the time hindered interrogation of novel lncRNAs and no experiments were performed to demonstrate the functional significance and mechanisms of lncRNAs beyond changes in their expression [ 63 , 64 ]. Our preliminary motif analyses with DNase-DGF (Digital DNase Genomic Footprinting) data and Mouse ENCODE (The Encyclopedia of DNA Elements) promoters showed that many other OPC-enriched lncRNAs may be regulated by OLIG2 [ 21 , 34 , 43 ]. Importantly, we have demonstrated that gene knockdown of our top candidate, lnc-OPC , significantly reduces OPCs differentiation from NSCs. OLIG2-binding sites in the upstream regulatory region of lnc-OPC have been identified in ChIP-Seq experiments and validated using luciferase assays. Notably, after our work focusing on OPCs formation was published in PLOS GENETICS, He et al. also published their interesting study demonstrating the important functional role of lncRNAs during oligodendrocyte differentiation stages, and cited the utilization of our databases for purified cells and spinal cord injury [ 22 ]. Thus, lncRNAs might be central to a new paradigm that defines oligodendrocyte development.

Our previous study showed that OLIG2 could bind and repress lnc-OPC expression in NSCs, likely to maintain NSC self-renewal [ 21 ]. In the current study, we found that OLIG2 did not bind to the upstream regulatory region of lnc-OPC in OPCs. Thus, lnc-OPC was no longer inhibited by OLIG2 and lnc-OPC expression level significantly increased in OPCs [ 21 ]. As we described, knocking down lnc-OPC greatly reduced the number of OPCs formed from NSCs suggesting that lnc-OPC is critical for OPCs formation. Besides lnc-OPC , in this study, we detected a total of 613 expressed lncRNAs that have OLIG2 called peaks in NSCs, OPCs, or NFOs, and that clustered according to their distinct expression patterns, as shown in Fig. 3 a. Genes from different clusters might play different roles in oligodendrocyte formation and differentiation. For instance, Crnde is grouped into cluster 5 and bear H3K4me3 marks in NSCs. According to the gene expression patterns of lncRNAs in eight purified brain cell types that we have published, Crnde appears to be an NSC-specific gene (Additional file 9 : Fig S4a). This observation is consistent with previous reports of the role of Crnde in the maintenance of cell pluripotency and its high expression in iPSCs (inducible pluripotency cells) [ 62 , 65 ]. Moreover, we found Crnde with OLIG2 called peaks in OPCs and NFOs, but not in NSCs, suggesting that Crnde may be repressed by Olig2 in the oligodendrocyte lineage. On the other hand, in cluster 7 we found lncRNAs with lower expression in NSCs than in OPCs and NFOs, suggesting these lncRNAs might play roles in oligodendrocytes differentiation (Fig. 3 a). Combining the results of our gene expression analyses with the observed OLIG2-binding patterns in NSCs, OPCs, and NFOs indicates that OLIG2 may act as a repressor of 39 lncRNAs in NSCs (group 1) and act as an activator of nine lncRNAs in both OPCs and NFOs (group 2). Our functional enrichment analysis showed that the expression of group 1 and 2 genes were positively correlated with oligodendrocyte development and differentiation (Fig. 3 b). The above results suggest that Olig2 potentially regulates oligodendrocyte differentiation through activation or repression of lncRNA expression. It is our future goal to test the results and hypotheses from these correlative analyses.

In an independent study, Olig2 was overexpressed in neural progenitor cells. We re-analyzed RNA-Seq data from Nishi et al. and identified genes that were differentially expressed after Olig2 overexpression [ 66 ]; some genes have OLIG2 binding motifs in our studies. For example, expression of Gm28513 was up-regulated upon overexpression of Olig2 (log2 (fold-change) > 2.4; p value < 0.001). Interestingly, our ChIP-Seq data indicates that Gm28513 has OLIG2 called peaks only in NSCs but not in oligodendrocyte lineages (Additional file 9 : Fig S4b) and has significantly higher expression in NSCs compared with OPCs (log2(fold-change) > 4.8; p value < 0.001). The function of lncRNAs predicted by “guilt by association” indicated that Gm28513 was enriched in the MSigDB functional term “oligodendrocyte differentiation” (NES = − 1.41). Collectively, these results suggest that Gm28513 may be activated by Olig2 and might function in NSCs self-renewal.

OLIG2 is a master regulator of oligodendrocyte fate determination that is essential for NSCs self-renewal and oligodendrocyte specification from NSCs, and that exerts diverse functions at different stages. Additionally, the differentiation of OPCs into mature oligodendrocytes is also regulated by OLIG2 [ 67 ]. In the current study, we identified putative Olig2 -regulated genes at different stages of oligodendrocyte differentiation based on our ChIP-Seq and RNA-Seq datasets across NSCs, OPCs, and NFOs. In our studies, we inferred potential OLIG2 activated/repressed genes based on OLIG2 called peaks and gene expression. H3K4me3 and H3K27me3 are only two of the chromatin marks and there are other activated/repressed chromatin marks. For example, to determine which OLIG2 called peaks are associated with an active enhancer mark, such as H3K27 acetylation, and test whether called peaks involved in repression may tend to lack this mark, we searched the literature for H3K27ac data. Bertolini et al. [ 68 ] and Wang et al. [ 69 ] identified OLIG2-activated genes in NSCs based on H3K27ac marks. We re-analyzed these data and compared the potential OLIG2 activated/repressed genes based on OLIG2 called peaks and gene expression with the H3K27ac peak positions. The results showed among these datasets, 51.8–62.1% of the inferred OLIG2-activated peaks were overlapping with H3K27ac called peaks. Thereby, potentially activated genes/peaks were more frequently associated with active enhancer mark such as H3K27ac, than potentially repressed genes/peaks by OLIG2.

During the transition from NSCs to OPCs, we found that the numbers of upregulated and downregulated genes annotated with OLIG2 called peaks were similar in each cell type (Fig. 2 a, c). However, during the transition from OPCs to NFOs, more OLIG2 called peaks belong to downregulated than upregulated genes (Fig. 2 b, d). NFOs are newly formed oligodendrocytes, the intermediate stage in the transition from OPCs to mature oligodendrocytes [ 43 ]. Our data showed that upregulated genes in NFOs annotated with OLIG2 called peaks were enriched in “oligodendrocyte differentiation” and that downregulated genes in NFOs were enriched in “neuron” and “neurogenesis” (Fig. 2 f). Therefore, Olig2 might both promote oligodendrocyte differentiation and repress neuronal fate in OPCs. One potential caveat in our ChIP-Seq analysis is that we only report called peaks instead of differential binding at different stages. Due to technical limitations, loci without peaks in a sample do not imply the absence of regulation at a particular stage.

During oligodendrocyte lineage specification, a number of stage-specific TFs control oligodendrocyte specification, differentiation, and myelination [ 8 ]. We characterized genome-wide OLIG2 occupancy across different stages of oligodendrocyte differentiation and its potential cooperation with other TFs to regulate oligodendrocyte development. Consistently, previous studies have shown that OLIG2 could function together with ALCL1 and further promote the differentiation of oligodendrocyte progenitors into oligodendrocytes [ 70 ]. Moreover, our data suggest that other TFs (MYC and SMAD2/3) occupy the overlapping OLIG2 binding regions. MYC motifs are enriched in the down-regulated genes in OPCs vs. NSCs and NFOs vs. OPCs, which is consistent with the reports that MYC could repress oligodendrocyte differentiation [ 71 , 72 ], and that the loss of Smad3 at E12.5 led to a severe oligodendrocyte phenotype including decreases in the numbers of progenitors and mature cells, and delay of myelination [ 73 ]. SOX family proteins are important transcription regulators [ 74 , 75 ]. We found SOX2 and SOX10 motifs were enriched in the OLIG2 called regions. Due to the relatively limited ability of motif-finding programs to discriminate SOX family of proteins and their overlapping functions, SOX proteins such as SOX8 and SOX9 may also potentially cooperate with OLIG2 in regulating oligodendrocyte development.

The interactions of TFs with chromatin and modified histones determine gene expression. Our genome-wide H3K4me3/H3K27me3 ChIP-Seq analysis in NSCs, OPCs, and NFOs showed that H3K4me3 or H3K27me3 marks were gained or lost in a specific group of genes at different stages of oligodendrocyte differentiation, which implies that these genes could dynamically be regulated and may function at specific stages of oligodendrocyte differentiation. Bivalent domains occupied by both H3K4me3 and H3K27me3 marks have important roles in pluripotency and cell differentiation. For example, genes with bivalent domains in their promoters are silent yet poised to be activated during the differentiation of ESCs [ 40 ]. However, little is known about the function of bivalent genes during oligodendrocyte development. We found that bivalent genes were dynamically regulated during the process of oligodendrocyte differentiation (Fig. 5 a). In particular, we found that the promoter regions of 459 genes that had bivalent domains in NSCs then presented “K4 only” marks in the oligodendrocyte lineage cells OPCs and NFOs. The gene expression patterns of 367 of these 459 genes detected at least in one cell type (FPKM > 1) were then analyzed by the k-means clustering method (Additional file 10 : Fig S5a). Six Clusters were generated and the expression of 94 genes in cluster 2 had increased in OPCs and NFOs (Additional file 10 : Fig S5a), which suggests that these genes might be activated during the differentiation of NSCs into oligodendrocyte lineage cells. Additionally, our results also showed that promoter regions of 108 genes contained bivalent domains in NSCs and OPCs but exhibited “K4 only” marks in NFOs (Additional file 10 : Fig S5b). The gene expression patterns of 72 of these 108 genes were analyzed using the same method with the former. Six Clusters were generated and three genes ( Epcam , Pdk1 , and Cbln2 ) in cluster 4 were expressed at lower levels in NSCs and OPCs than in NFOs (Additional file 10 : Fig S5b). The results suggested that these genes might become activated after the OPCs stage and thereby promote OPC differentiation into oligodendrocytes.

The bivalent genes in NSCs began to be activated at different stages (OPCs or NFOs) after NSCs. To investigate whether the activated genes might be regulated by OLIG2, we correlate the OLIG2 ChIP-Seq with RNA-Seq in NSC, OPC, and NFO. Our data showed that 13 bivalent genes of the 94 activated genes ( Pcdh15 , Ptprk , Tmem132d , Mkrn1 , Fbll1 , Slc1a1 , Kif26a , Ugt8a , 2210016F16Rik , Bnip3l , Rell1 , Taok3 , and Cadm2 ) had OLIG2 called peaks in OPCs and NFOs, but not in NSCs. These genes were also highly expressed in OPCs and NFOs, which suggests that they might be activated by OLIG2 in OPCs and NFOs and subsequently function in oligodendrocyte differentiation. In particular, the activated gene Epcam had OLIG2 called peaks only in NFOs, which suggests that it might be regulated by OLIG2 and function during OPCs differentiation into NFOs. Together, these results suggest that the dynamic modification of bivalent genes could have essential roles in oligodendrocyte differentiation and development and that some genes might be regulated by OLIG2 during this process. A potential caveat of our bivalent genes’ analysis is that the overlap of H3K27 and H3K4 methylation is not at the single cell level. As there could be multiple subpopulations within our isolated cells, single cell experiments are needed in the future to comprehensively study the dynamics of gene activation and repression.

One of the potential mechanisms by which OLIG2 could regulate oligodendrocyte development is through lncRNAs. We know that lncRNAs often bind to chromatin modification complexes to guide them to specific locations in the genome, changing epigenetic landscapes and controlling downstream genes to define cell fate. Our experiments showed that lnc-OPC was bound to EZH2 and SUZ12 in NSCs (Additional file 11 : Fig S6). EZH2 and SUZ12 are two subunits of the PRC2 chromatin modification complex [ 76 ], and He et al. have also demonstrated that lncOL1 and SUZ12/PRC2 could form a complex to increase expression of oligodendrocyte differentiation-related genes to promote oligodendrocyte differentiation [ 22 ].

The basic helix-loop-helix (bHLH) proteins have been reported to act as RNA-binding protein previously [ 77 ]. For example, the helix-loop-helix (HLH) domain has been identified as an RNA-binding motif in eukaryotic translation initiation factor 3 (eIF3) [ 77 ]. eIF3 can not only regulate translation of hepatitis C virus RNAs by binding to the Internal Ribosome Entry Site (IRES) but also control translation of oncogenic MYC gene by interacting with its 5′-UTR elements [ 77 ]. Our OLIG2 RIP-Seq data in NSCs showed that the most significant OLIG2 target was its own 3′ UTR. An RNA protein pull-down assay was performed and confirmed that OLIG2 could interact with Olig2 mRNA. This is consistent with previous reports in the literature showing that DNA-binding TFs can also interact with RNAs in some cases [ 78 ]. For example, Yin-Yang 1 (YY1), a well-known TF in the regulation of oligodendrocyte progenitor differentiation, can bind to both DNA regulatory elements and RNAs of its target genes [ 52 ]. The tethered RNA species reinforce YY1 occupancy at these elements and stabilize the gene expression process [ 52 ]. Intriguingly, some proteins have autoregulation potential: they can function in a feedback loop by binding to the ARE in their own mRNA to regulate mRNA processing, stability, or translational efficiency [ 52 , 78 – 80 ]. For instance, TDP-43 and the HTT protein interact with several ARE in their own mRNA to regulate their own expression [ 41 , 42 ]. In our study, we also found several AREs in the 3′ UTR of the Olig2 mRNA (Additional file 12 : Fig S7a) using AREsite, an online database for the identification of AU-rich elements [ 81 ], and evolutionary conservation analysis indicated that these AU-rich regions are highly conserved across multiple species including mouse and human (Additional file 12 : Fig S7b). Additionally, we observed the expression of endogenous OLIG2 protein can be influenced by Olig2 3′ UTR. These results suggest Olig2 3′ UTR may directly or indirectly interact with OLIG2 protein by competing endogenous Olig2 mRNA. Whether this interaction is direct or indirect still needs further investigation. Also, we cannot rule out the possibility that 3′ UTR can sequester other molecules that may reduce OLIG2 expression such as microRNAs and this can be tested in the future.

Through the analysis of OLIG2 RIP-Seq data, we found that OLIG2 significantly binds other targets (e.g. Noc2l , Rae-1 , and Rfc3 ) with reported relevant functions in NSC biology. Using single cell transcriptomics researchers found Noc2l , an inhibitor of histone acetyltransferases, to be an early neural progenitor marker [ 82 ]. In another study Rae-1 , the retinoic acid early induced transcript was found to be involved in regulating adult SVZ by supporting progenitor cell proliferation [ 83 ]. Interestingly Rfc3 , the replication factor C subunit 3 is a predicted target gene of OLIG2 in the CHEA Transcription Factor Targets dataset from the Harmonizome database [ 84 ]. These results suggest that OLIG2 contributes to NSC proliferation by regulation after transcription. Further experiments are required to validate the binding of OLIG2 to other target mRNAs and the functional implications of these regulatory mechanisms in NSCs.",,"Relationship structure: causal chain.

OLIG2 is a master regulator required for oligodendrocyte lineage specification and for later stages of oligodendrocyte differentiation in vivo in mouse across NSCs, OPCs, and NFOs. Mechanistically, OLIG2 binds genomic DNA to directly activate or repress many protein-coding genes and >600 expressed lncRNAs (some lncRNAs are OLIG2-repressed in NSCs and others OLIG2-activated in OPCs/NFOs), occupies promoter regions of dynamically regulated bivalent genes (H3K4me3/H3K27me3), and likely cooperates with other TFs at shared motifs. Separately, OLIG2 binds the AU-rich 3′ UTR of its own Olig2 mRNA and, in reporter and competition experiments, can inhibit reporter expression via that 3′ UTR and influence endogenous OLIG2 protein levels, indicating self-regulation after transcription. Outcomes include modulation of OPC formation, promotion of oligodendrocyte differentiation, and repression of neuronal programs."
