id,claim,citation,question,claim_answer,paper_answer,answer_note
1,KLF4 functions as a tumor suppressor in colorectal cancer.,[1];[2];[3],Does KLF4 function as a tumor suppressor in colorectal cancer?,Yes,Yes,
2,KLF4 inhibits WNT signaling in colorectal cancer.,[1];[2],Does KLF4 inhibit WNT signaling in colorectal cancer?,Yes,Yes,
3,"In F. nucleatum–associated late-stage colorectal cancer, Ca2+-driven E-cadherin–KLF4 interaction causes KLF4 nuclear translocation.",[1],"In F. nucleatum–associated late-stage colorectal cancer, does Ca2+-driven E-cadherin–KLF4 interaction cause KLF4 nuclear translocation?",Yes,Yes,
4,"In F. nucleatum–associated late-stage colorectal cancer, KLF4 nuclear translocation induces ITGA5 transcription.",[1],"In F. nucleatum–associated late-stage colorectal cancer, does KLF4 nuclear translocation induce ITGA5 transcription?",Yes,Yes,
5,"In F. nucleatum–associated late-stage colorectal cancer, the Ca2+-driven E-cadherin–KLF4 interaction promotes tumor growth and metastasis.",[1],"In F. nucleatum–associated late-stage colorectal cancer, does the Ca2+-driven E-cadherin–KLF4 interaction promote tumor growth and metastasis?",Yes,Yes,
6,KLF4 dampens pre-metastatic niche formation in colorectal cancer.,[4],Does KLF4 dampen pre-metastatic niche formation in colorectal cancer?,Yes,Yes,
7,KLF4 dampens metastasis in colorectal cancer.,[4],Does KLF4 dampen metastasis in colorectal cancer?,Yes,Yes,
8,Colorectal cancer exosomal miR-25-3p downregulates endothelial KLF4.,[4],Does colorectal cancer exosomal miR-25-3p downregulate endothelial KLF4?,Yes,Yes,
9,Endothelial KLF4 downregulation correlates with decreased KLF2.,[4],Does endothelial KLF4 downregulation correlate with decreased KLF2?,Yes,Yes,
10,Endothelial KLF4 downregulation correlates with decreased tight-junction proteins.,[4],Does endothelial KLF4 downregulation correlate with decreased tight-junction proteins?,Yes,Yes,
11,Endothelial KLF4 downregulation correlates with increased VEGFR2.,[4],Does endothelial KLF4 downregulation correlate with increased VEGFR2?,Yes,Yes,
12,miR-25-3p promotes angiogenesis in lung and liver.,[4],Does miR-25-3p promote angiogenesis in the lung and liver?,Yes,Yes,
13,miR-25-3p promotes vascular permeability in lung and liver.,[4],Does miR-25-3p promote vascular permeability in the lung and liver?,Yes,Yes,
14,miR-25-3p promotes metastasis in lung and liver.,[4],Does miR-25-3p promote metastasis in the lung and liver?,Yes,Yes,
15,KLF4 functions as a terminal differentiation regulator in colorectal cancer.,[2],Does KLF4 function as a terminal differentiation regulator in colorectal cancer?,Yes,Yes,
16,KLF4 inhibits WNT signaling by competitively interacting with β-catenin.,[2],Does KLF4 inhibit WNT signaling by competitively interacting with beta-catenin?,Yes,Yes,
17,Suppression of KLF4 activates WNT signaling to sustain colorectal cancer cells in a rapidly dividing undifferentiated state.,[2],Does suppression of KLF4 activate WNT signaling to sustain rapidly dividing undifferentiated colorectal cancer cells?,Yes,Yes,
18,KLF4 is downregulated in human colorectal cancer.,[3],Is KLF4 downregulated in human colorectal cancer?,Yes,Yes,
19,KLF4 inhibits colorectal cancer growth by upregulating p21.,[3],Does KLF4 inhibit colorectal cancer growth by upregulating p21?,Yes,Yes,
20,KLF4 inhibits colorectal cancer growth by upregulating NDRG2.,[3],Does KLF4 inhibit colorectal cancer growth by upregulating NDRG2?,Yes,Yes,
21,KLF4 inhibits colorectal cancer growth by downregulating cyclin D1.,[3],Does KLF4 inhibit colorectal cancer growth by downregulating cyclin D1?,Yes,Yes,
22,KLF4 deficiency or microRNA-mediated downregulation promotes proliferation in colorectal cancer.,[3],Does KLF4 deficiency or microRNA-mediated downregulation promote proliferation in colorectal cancer?,Yes,Yes,
23,KLF4 deficiency or microRNA-mediated downregulation promotes migration in colorectal cancer.,[3],Does KLF4 deficiency or microRNA-mediated downregulation promote migration in colorectal cancer?,Yes,Yes,
24,KLF4 deficiency or microRNA-mediated downregulation promotes epithelial–mesenchymal transition.,[3],Does KLF4 deficiency or microRNA-mediated downregulation promote epithelial–mesenchymal transition?,Yes,Yes,
25,KLF4 deficiency or microRNA-mediated downregulation promotes tumor progression in colorectal cancer.,[3],Does KLF4 deficiency or microRNA-mediated downregulation promote tumor progression in colorectal cancer?,Yes,Yes,
26,"In colorectal cancer, KLF4 regulates COL12A1.",[5],"In colorectal cancer, does KLF4 regulate COL12A1?",Yes,Yes,
27,KLF4 overexpression in HCT116 colorectal cancer cells reduced COL12A1.,[5],Does KLF4 overexpression in HCT116 colorectal cancer cells reduce COL12A1?,Yes,Yes,
28,KLF4 upregulation associates with glycolysis suppression in colorectal cancer.,[5],Does KLF4 upregulation associate with glycolysis suppression in colorectal cancer?,Yes,Yes,
29,Caffeine upregulated KLF4 across colorectal cancer cell lines.,[5],Does caffeine upregulate KLF4 across colorectal cancer cell lines?,Yes,Yes,
30,Caffeine decreased COL12A1 in colorectal cancer cell lines.,[5],Does caffeine decrease COL12A1 in colorectal cancer cell lines?,Yes,Yes,
