id,claim,question,claim_answer,evidence_answer,answer_note
1,CEBPA is described as a master regulator of myeloid differentiation.,Is CEBPA described as a master regulator of myeloid differentiation?,Yes,,
2,CEBPA is a master regulator that drives hematopoiesis toward the granulocytic (neutrophil) lineage.,Is CEBPA a master regulator driving hematopoiesis toward the granulocytic lineage?,Yes,,
3,CEBPA is a master regulator of myeloid differentiation.,Is CEBPA a master regulator of myeloid differentiation?,Yes,,
4,CEBPA expression peaks in the granulocyte‑monocyte progenitor stage.,Does CEBPA expression peak in the granulocyte-monocyte progenitor stage?,Yes,,
5,Cebpa-null mice lack neutrophils and eosinophils.,Do Cebpa-null mice lack neutrophils and eosinophils?,Yes,,
6,CEBPA expression peaks in the granulocyte-monocyte progenitor stage.,Does CEBPA expression peak at the granulocyte-monocyte progenitor stage?,Yes,,
7,CEBPA expression diminishes during terminal granulocyte differentiation.,Does CEBPA expression diminish during terminal granulocyte differentiation?,Yes,,
8,"In APL cell models and AML patient samples during ATRA-mediated neutrophil differentiation, CEBPA activates HK3 transcription as supported by promoter mutational evidence.","Does CEBPA activate HK3 transcription in ATRA-differentiated APL/AML models, supported by promoter mutation evidence?",Yes,,
9,CEBPA acts as a positive transcriptional regulator during granulocytic differentiation.,Does CEBPA act as a positive transcriptional regulator during granulocytic differentiation?,Yes,,
10,"In APL cell lines NB4 and HT93, CEBPA is required for upregulation of HK3 during ATRA‑induced neutrophil differentiation.",Is CEBPA required for HK3 upregulation during ATRA-induced neutrophil differentiation in NB4 and HT93 cells?,Yes,,
11,"In APL cell models and AML patient samples during ATRA-mediated neutrophil differentiation, CEBPA activates KLF5 expression.",Does CEBPA activate KLF5 expression during ATRA-mediated neutrophil differentiation in APL/AML models?,Yes,,
12,"In APL cell lines NB4 and HT93 undergoing ATRA-induced neutrophil differentiation, CEBPA is required for upregulation of HK3.","In NB4 and HT93 cells with ATRA-induced neutrophil differentiation, is CEBPA required to upregulate HK3?",Yes,,
13,"In APL cell lines NB4 and HT93, CEBPA is required for upregulation of KLF5 during ATRA‑induced neutrophil differentiation.",Is CEBPA required for KLF5 upregulation during ATRA-induced neutrophil differentiation in NB4 and HT93 cells?,Yes,,
14,The activation of KLF5 by CEBPA in APL cell models and AML patient samples during ATRA-mediated neutrophil differentiation is CEBPA-dependent but likely indirect.,Is KLF5 activation by CEBPA in ATRA-treated APL/AML models CEBPA-dependent but likely indirect?,Yes,,
15,"In APL cell lines NB4 and HT93 undergoing ATRA-induced neutrophil differentiation, CEBPA is required for upregulation of KLF5.","In NB4 and HT93 cells with ATRA-induced neutrophil differentiation, is CEBPA required to upregulate KLF5?",Yes,,
16,CEBPA knockdown in NB4 and HT93 reduced HK3 mRNA after four days of 1 μM ATRA.,Did CEBPA knockdown reduce HK3 mRNA after four days of 1 μM ATRA in NB4 and HT93?,Yes,,
17,"In APL cell models and AML patient samples during ATRA-mediated neutrophil differentiation, promoter mutations in KLF5 did not abolish reporter responsiveness to CEBPA.",Did KLF5 promoter mutations fail to abolish reporter responsiveness to CEBPA in those models?,Yes,,
18,"In APL cell lines NB4 and HT93 undergoing ATRA-induced neutrophil differentiation, CEBPA knockdown reduced HK3 mRNA.","In NB4 and HT93 cells with ATRA-induced neutrophil differentiation, did CEBPA knockdown reduce HK3 mRNA?",Yes,,
19,CEBPA knockdown in NB4 and HT93 reduced KLF5 mRNA after four days of 1 μM ATRA.,Did CEBPA knockdown reduce KLF5 mRNA after four days of 1 μM ATRA in NB4 and HT93?,Yes,,
20,"In APL cell models and AML patient samples during ATRA-mediated neutrophil differentiation, induction of KLF5 requires the full-length p42 isoform of CEBPA.",Does KLF5 induction require the full-length p42 CEBPA isoform in those models?,Yes,,
21,"In APL cell lines NB4 and HT93 undergoing ATRA-induced neutrophil differentiation, CEBPA knockdown reduced KLF5 mRNA.","In NB4 and HT93 cells with ATRA-induced neutrophil differentiation, did CEBPA knockdown reduce KLF5 mRNA?",Yes,,
22,Ectopic CEBPA expression in HT93 increased HK3 transcription.,Did ectopic CEBPA expression increase HK3 transcription in HT93 cells?,Yes,,
23,"In AML, loss of CEBPA expression or CEBPA mutations correlate with reduced HK3 expression.","In AML, do loss of CEBPA expression or CEBPA mutations correlate with reduced HK3 expression?",Yes,,
24,Ectopic CEBPA expression in HT93 cells induced HK3 mRNA.,Did ectopic CEBPA expression in HT93 cells induce HK3 mRNA?,Yes,,
25,Ectopic CEBPA expression in HT93 increased KLF5 transcription.,Did ectopic CEBPA expression increase KLF5 transcription in HT93 cells?,Yes,,
26,"In AML, loss of CEBPA expression or CEBPA mutations correlate with reduced KLF5 expression.","In AML, do loss of CEBPA expression or CEBPA mutations correlate with reduced KLF5 expression?",Yes,,
27,Ectopic CEBPA expression in HT93 cells induced KLF5 mRNA.,Did ectopic CEBPA expression in HT93 cells induce KLF5 mRNA?,Yes,,
28,"In K562 lines, activation of full‑length CEBPA‑p42 induced KLF5.",Did activation of full-length CEBPA-p42 induce KLF5 in K562 cell lines?,Yes,,
29,"In AML, impaired CEBPA function is associated with defective granulocytic differentiation.","In AML, is impaired CEBPA function associated with defective granulocytic differentiation?",Yes,,
30,"In K562 cells, activation of full-length CEBPA-p42 specifically activated KLF5 transcription.","In K562 cells, did activation of full-length CEBPA-p42 specifically activate KLF5 transcription?",Yes,,
31,"In K562 lines, activation of CEBPA‑p30 did not induce KLF5.",Did activation of CEBPA-p30 fail to induce KLF5 in K562 cell lines?,Yes,,
32,"In K562 cells, truncated CEBPA-p30 did not activate KLF5 transcription.","In K562 cells, did truncated CEBPA-p30 not activate KLF5 transcription?",Yes,,
33,"In K562 lines, activation of CEBPA‑BRM2 did not induce KLF5.",Did activation of CEBPA-BRM2 fail to induce KLF5 in K562 cell lines?,Yes,,
34,"In K562 cells, a p42 CEBPA mutant that prevents E2F interaction did not activate KLF5 transcription.","In K562 cells, did a p42 CEBPA mutant that prevents E2F interaction fail to activate KLF5 transcription?",Yes,,
35,"In AML patient cohorts, disrupted CEBPA function correlated with significantly lower HK3 mRNA expression.",Did disrupted CEBPA function correlate with significantly lower HK3 mRNA in AML patient cohorts?,Yes,,
36,"In AML patient cohorts, disrupted CEBPA function correlated with significantly lower KLF5 mRNA expression.",Did disrupted CEBPA function correlate with significantly lower KLF5 mRNA in AML patient cohorts?,Yes,,
37,Loss of HK3 expression correlated with CEBPA mutations irrespective of whether the CEBPA mutations were single or double.,Did loss of HK3 expression correlate with CEBPA mutations regardless of single or double mutations?,Yes,,
38,Loss of KLF5 expression correlated with CEBPA mutations irrespective of whether the CEBPA mutations were single or double.,Did loss of KLF5 expression correlate with CEBPA mutations regardless of single or double mutations?,Yes,,
