id,claim,question,claim_answer,evidence_answer,answer_note
1,PU.1 (SPI1) governs development of the macrophage lineage in mice.,Does PU.1 govern macrophage lineage development in mice?,Yes,,
2,PU.1 (SPI1) specifies the macrophage/microglia lineage during development in mouse and zebrafish.,Does PU.1 (SPI1) specify the macrophage/microglia lineage during development in mouse and zebrafish?,Yes,,
3,PU.1 (SPI1) functions as a master regulator of macrophage and microglia development in mammals and teleosts.,Does PU.1 (SPI1) function as a master regulator of macrophage and microglia development in mammals and teleosts?,Yes,,
4,PU.1 (SPI1) acts as a master regulator for macrophage and microglia development in fish and mammals.,Does PU.1 act as a master regulator of macrophage and microglia development in fish and mammals?,Yes,,
5,PU.1 (SPI1) is required for embryonic macrophage generation and embryonic microglia generation.,Is PU.1 (SPI1) required for embryonic macrophage and microglia generation?,Yes,,
6,PU.1 controls expression of genes required for macrophage and microglia development.,Does PU.1 control expression of genes required for macrophage and microglia development?,Yes,,
7,PU.1 disruption causes embryonic lethality in mice.,Does PU.1 disruption cause embryonic lethality in mice?,Yes,,
8,Global disruption of PU.1 (SPI1) causes embryonic lethality.,Does global disruption of PU.1 (SPI1) cause embryonic lethality?,Yes,,
9,Loss of PU.1 leads to downregulation of Csf1r.,Does loss of PU.1 lead to downregulation of Csf1r?,Yes,,
10,PU.1 disruption causes complete absence of macrophages including microglia in mice.,"Does PU.1 disruption cause complete absence of macrophages, including microglia, in mice?",Yes,,
11,Global disruption of PU.1 (SPI1) causes absence of embryonic macrophages and absence of embryonic microglia.,Does global disruption of PU.1 (SPI1) cause absence of embryonic macrophages and microglia?,Yes,,
12,Loss of PU.1 leads to loss of anti-apoptotic genes such as BCL2A1.,Does loss of PU.1 lead to loss of anti-apoptotic genes such as BCL2A1?,Yes,,
13,In pu.1-null zebrafish mutants macrophage and microglia development is completely blocked at early development.,"In pu.1-null zebrafish, is macrophage and microglia development completely blocked early?",Yes,,
14,"In adults, PU.1/Spi1 dosage regulates microglia survival.",Does PU.1/Spi1 dosage regulate microglia survival in adults?,Yes,,
15,ChIP-Seq in BV2 cells revealed thousands of PU.1 targets.,Did ChIP-Seq in BV2 cells reveal thousands of PU.1 targets?,Yes,,
16,PU.1 dosage is highly sensitive for the survival of microglia in teleosts and mammals.,Is PU.1 dosage highly sensitive for microglial survival in teleosts and mammals?,Yes,,
17,"In adults, PU.1/Spi1 dosage regulates long-term maintenance of microglia.",Does PU.1/Spi1 dosage regulate long-term maintenance of adult microglia?,Yes,,
18,Disruption of PU.1 in mice causes embryonic lethality.,Does disruption of PU.1 in mice cause embryonic lethality?,Yes,,
19,PU.1 dosage is highly sensitive for the maintenance of microglia in teleosts and mammals.,Is PU.1 dosage highly sensitive for microglial maintenance in teleosts and mammals?,Yes,,
20,Complete loss of Pu.1 together with Spi‑b loss in zebrafish causes rapid microglial depletion.,Does complete loss of Pu.1 together with Spi1b loss in zebrafish cause rapid microglial depletion?,Yes,,
