in_text_citation,reference,url,real_reference,real_url,alternative_url,hash_id
[2],"Kimberley C. Agbo, Jessie Huang, A. Ghaleb, Jennie Williams, K. Shroyer, A. Bialkowska et al.. Loss of the Krüppel-like factor 4 tumor suppressor is associated with epithelial-mesenchymal transition in colorectal cancer. n.d.. Citations: 15. https://www.semanticscholar.org/paper/1ffc277060bb5405dab733224f6cb491e1017f65",https://www.semanticscholar.org/paper/1ffc277060bb5405dab733224f6cb491e1017f65,true,true,,_h58QHwso0jcWxa8
[3],"Xuan Deng, Fanyang Kong, Si-Ning Li, Haoqin Jiang, Liu Dong, Xiao Xu et al.. A KLF4/PiHL/EZH2/HMGA2 regulatory axis and its function in promoting oxaliplatin-resistance of colorectal cancer. n.d.. Citations: 61. https://www.semanticscholar.org/paper/bac4e8b41a6369fff546bf0bd3e9cecaa7eab69e",https://www.semanticscholar.org/paper/bac4e8b41a6369fff546bf0bd3e9cecaa7eab69e,true,true,,JPfeRAs3gMICoKDA
[8],"Yu Zheng, Jiansheng Wu, Hong Chen, D. Lin, Hongyuan Chen, Jun-hu Zheng et al.. KLF4 targets RAB26 and decreases 5-FU resistance through inhibiting autophagy in colon cancer. n.d.. Citations: 18. https://www.semanticscholar.org/paper/88fdb9041eb3b82387992bed430c46428364e511",https://www.semanticscholar.org/paper/88fdb9041eb3b82387992bed430c46428364e511,true,true,,nzEje7-gkNeKWvZj
[4],"W. Tang, Yunxiang Zhu, Jun Gao, Jihong Fu, Charles Liu, Yingbin Liu et al.. MicroRNA-29a promotes colorectal cancer metastasis by regulating matrix metalloproteinase 2 and E-cadherin via KLF4. n.d.. Citations: 181. https://www.semanticscholar.org/paper/6699fa1e17a84b15f9152a02c07a1ef0a627f2df",https://www.semanticscholar.org/paper/6699fa1e17a84b15f9152a02c07a1ef0a627f2df,true,true,,aJ85mk8H48fZcV3_
[5],"Fangbing Zhai, Chunhong Cao, Liang Zhang, Jianhua Zhang. miR-543 promotes colorectal cancer proliferation and metastasis by targeting KLF4. n.d.. Citations: 49. https://www.semanticscholar.org/paper/e82a305c6bde3b11c477468890188889f96de4ba",https://www.semanticscholar.org/paper/e82a305c6bde3b11c477468890188889f96de4ba,true,true,,KyGSSGmqWNNVovEz
[1],"Yuanyuan Shang, Zhe Zhu, Yuanyuan Zhang, Fang Ji, Lian Zhu, Mengcheng Liu et al.. MiR-7-5p/KLF4 signaling inhibits stemness and radioresistance in colorectal cancer. n.d.. Citations: 30. https://www.semanticscholar.org/paper/fa66e64072ce0e367620491716705c2724b6608a",https://www.semanticscholar.org/paper/fa66e64072ce0e367620491716705c2724b6608a,true,true,,rMmxMLWY6pVnCu82
[9],"Xu Yang, Guilin Li, Yuhua Tian, X. Wang, Jiuzhi Xu, Ruiqi Liu et al.. Identifying the E2F3-MEX3A-KLF4 signaling axis that sustains cancer cells in undifferentiated and proliferative state. n.d.. Citations: 27. https://www.semanticscholar.org/paper/4354a5c6982efdb70bb778507b17e1eb1da45946",https://www.semanticscholar.org/paper/4354a5c6982efdb70bb778507b17e1eb1da45946,true,true,,e4vOxvwdhO6LI7fr
