id,claim,question,claim_answer,evidence_answer,answer_note
1,KLF4 acts as a tumor suppressor in colorectal cancer.,Does KLF4 act as a tumor suppressor in colorectal cancer?,Yes,,
2,"In colorectal cancer in human tissues and mouse models, KLF4 functions as a tumor suppressor.",Does KLF4 function as a tumor suppressor in human colorectal cancer tissues and mouse models?,Yes,,
3,KLF4 functions as a tumor suppressor in human colorectal cancer.,Does KLF4 function as a tumor suppressor in human colorectal cancer?,Yes,,
4,KLF4 is downregulated in human colorectal cancer tissues compared with normal mucosa.,Is KLF4 downregulated in human colorectal cancer tissues compared with normal mucosa?,Yes,,
5,KLF4 is downregulated in human CRC versus normal mucosa.,Is KLF4 downregulated in human colorectal cancer compared to normal mucosa?,Yes,,
6,KLF4 is downregulated in CRC tissues compared with normal mucosa.,Is KLF4 downregulated in CRC tissues compared with normal mucosa?,Yes,,
7,KLF4 inhibited colorectal cancer growth in mice.,Did KLF4 inhibit colorectal cancer growth in mice?,Yes,,
8,KLF4 inhibits tumor growth in mice.,Does KLF4 inhibit tumor growth in mice?,Yes,,
9,KLF4 inhibits colorectal cancer growth in mice.,Does KLF4 inhibit colorectal cancer growth in mice?,Yes,,
10,In colorectal cancer cells KLF4 upregulated p21.,Did KLF4 upregulate p21 in colorectal cancer cells?,Yes,,
11,KLF4 restrains colorectal cancer cell proliferation by upregulating p21.,Does KLF4 restrain colorectal cancer cell proliferation by upregulating p21?,Yes,,
12,KLF4 inhibits CRC cell proliferation by upregulating p21.,Does KLF4 inhibit CRC cell proliferation by upregulating p21?,Yes,,
13,In colorectal cancer cells KLF4 upregulated NDRG2.,Did KLF4 upregulate NDRG2 in colorectal cancer cells?,Yes,,
14,KLF4 restrains colorectal cancer cell proliferation by upregulating NDRG2.,Does KLF4 restrain colorectal cancer cell proliferation by upregulating NDRG2?,Yes,,
15,KLF4 inhibits CRC cell proliferation by upregulating NDRG2.,Does KLF4 inhibit CRC cell proliferation by upregulating NDRG2?,Yes,,
16,In colorectal cancer cells KLF4 downregulated cyclinD1.,Did KLF4 downregulate cyclinD1 in colorectal cancer cells?,Yes,,
17,KLF4 restrains colorectal cancer cell proliferation by downregulating cyclin D1.,Does KLF4 restrain colorectal cancer cell proliferation by downregulating cyclin D1?,Yes,,
18,KLF4 inhibits CRC cell proliferation by downregulating cyclinD1.,Does KLF4 inhibit CRC cell proliferation by downregulating cyclin D1?,Yes,,
19,In colorectal cancer cells KLF4 downregulated GINS4.,Did KLF4 downregulate GINS4 in colorectal cancer cells?,Yes,,
20,KLF4 restrains colorectal cancer cell proliferation by downregulating GINS4.,Does KLF4 restrain colorectal cancer cell proliferation by downregulating GINS4?,Yes,,
