Gene,Summary,PMID,References,Note
FOXR2,"FOXR2 functions as an oncogenic driver that is essential in neuroblastoma [1,2]. FOXR2 activation designates a distinct CNS neuroblastoma entity (NB-FOXR2) [1,3,4]. FOXR2 activation designates a CNS neuroblastoma entity with embryonal small-cell histology and near-uniform OLIG2 and synaptophysin expression [1]. Sequencing identified complex genomic rearrangements converging on FOXR2 that increased its expression [1]. FOXR2 activation instigates oncogenic activity [1]. FOXR2 stabilizes MYCN protein and thereby forms an alternative mechanism to MYCN amplification [2]. The FOXR2-activated subset shows an unfavorable clinical outcome [2]. FOXR2 activation defines NB-FOXR2 as tumors from LHX6+/DLX+ medial ganglionic eminence interneuron lineages [5]. FOXR2 binds chromatin and transcription factors to activate glial programs that may explain the tumors' mixed neuronal and oligodendroglial features [5]. FOXR2 activation is regarded as pathognomonic for CNS neuroblastoma (NB-FOXR2) [3]. All CNS NB-FOXR2 were cerebral cortical tumors [3]. CNS Neuroblastoma with FOXR2 activation (CNS NB-FOXR2) is a distinct tumor group identified among previously diagnosed CNS-PNETs [4].","26919435
34110923
40237561
32650833
39495206","[1] Sturm, D., Orr, B. A., Toprak, U. H., Hovestadt, V., Jones, D. T. W., Capper, D., Sill, M., Buchhalter, I., Northcott, P. A., Leis, I., Ryzhova, M., Koelsche, C., Pfaff, E., Allen, S. J., Balasubramanian, G., Worst, B. C., Pajtler, K. W., Brabetz, S., Johann, P. D., Sahm, F., Reimand, J., Mackay, A., Carvalho, D. M., Remke, M., Phillips, J. J., Perry, A., Cowdrey, C., Drissi, R., Fouladi, M., Giangaspero, F., Łastowska, M., Grajkowska, W., Scheurlen, W., Pietsch, T., Hagel, C., Gojo, J., Lötsch, D., Berger, W., Slavc, I., Haberler, C., Jouvet, A., Holm, S., Hofer, S., Prinz, M., Keohane, C., Fried, I., Mawrin, C., Scheie, D., Mobley, B. C., Schniederjan, M. J., Santi, M., Buccoliero, A. M., Dahiya, S., Kramm, C. M., von Bueren, A. O., von Hoff, K., Rutkowski, S., Herold-Mende, C., Frühwald, M. C., Milde, T., Hasselblatt, M., Wesseling, P., Rößler, J., Schüller, U., Ebinger, M., Schittenhelm, J., Frank, S., Grobholz, R., Vajtai, I., Hans, V., Schneppenheim, R., Zitterbart, K., Collins, V. P., Aronica, E., Varlet, P., Puget, S., Dufour, C., Grill, J., Figarella-Branger, D., Wolter, M., Schuhmann, M. U., Shalaby, T., Grotzer, M., van Meter, T., Monoranu, C. M., Felsberg, J., Reifenberger, G., Snuderl, M., Forrester, L. A., Koster, J., Versteeg, R., Volckmann, R., van Sluis, P., Wolf, S., Mikkelsen, T., Gajjar, A., Aldape, K., Moore, A. S., Taylor, M. D., Jones, C., Jabado, N., Karajannis, M. A., Eils, R., Schlesner, M., Lichter, P., von Deimling, A., Pfister, S. M., Ellison, D. W., Korshunov, A., & Kool, M. (2016). New Brain Tumor Entities Emerge from Molecular Classification of CNS-PNETs. <i>Cell</i>, 164(5), 1060-1072. https://doi.org/10.1016/j.cell.2016.01.015
[2] Schmitt-Hoffner, F., van Rijn, S., Toprak, U. H., Mauermann, M., Rosemann, F., Heit-Mondrzyk, A., Hübner, J. M., Camgöz, A., Hartlieb, S., Pfister, S. M., Henrich, K. O., Westermann, F., & Kool, M. (2021). FOXR2 Stabilizes MYCN Protein and Identifies Non-<i>MYCN</i>-Amplified Neuroblastoma Patients With Unfavorable Outcome. <i>J Clin Oncol</i>, 39(29), 3217-3228. https://doi.org/10.1200/jco.20.02540
[3] Siskar, A. N., Hanzlik, E., Cardenas, M. F., Eldomery, M. K., Pinto, S., Tinkle, C. L., Zhang, Q., Li, X., Lin, T., Dhanda, S. K., Reis, G., Li, D., Raghavan, R., Vortmeyer, A., Karajannis, M. A., Robinson, G. W., Onar-Thomas, A., Blackburn, P. R., Wheeler, D. A., & Chiang, J. (2025). FOXR2 activation is not exclusive of CNS neuroblastoma. <i>Neuro Oncol</i>, 27(7), 1801-1812. https://doi.org/10.1093/neuonc/noaf076
[4] Łastowska, M., Trubicka, J., Sobocińska, A., Wojtas, B., Niemira, M., Szałkowska, A., Krętowski, A., Karkucińska-Więckowska, A., Kaleta, M., Ejmont, M., Perek-Polnik, M., Dembowska-Bagińska, B., Grajkowska, W., & Matyja, E. (2020). Molecular identification of CNS NB-FOXR2, CNS EFT-CIC, CNS HGNET-MN1 and CNS HGNET-BCOR pediatric brain tumors using tumor-specific signature genes. <i>Acta Neuropathol Commun</i>, 8(1), 105. https://doi.org/10.1186/s40478-020-00984-9
[5] Jessa, S., De Cola, A., Chandarana, B., McNicholas, M., Hébert, S., Ptack, A., Faury, D., Tsai, J. W., Korshunov, A., Phoenix, T. N., Ellezam, B., Jones, D. T. W., Taylor, M. D., Bandopadhayay, P., Pathania, M., Jabado, N., & Kleinman, C. L. (2025). FOXR2 Targets LHX6+/DLX+ Neural Lineages to Drive Central Nervous System Neuroblastoma. <i>Cancer Res</i>, 85(2), 231-250. https://doi.org/10.1158/0008-5472.can-24-2248
",
