in_text_citation,reference,url,real_reference,real_url,alternative_url,hash_id
[0],"- [0] D. Edmondson, E. Olson. A gene with homology to the myc similarity region of MyoD1 is expressed during myogenesis and is sufficient to activate the muscle differentiation program.. n.d.. Citations: 111. https://www.semanticscholar.org/paper/e00763ecee94bf83523e13a22486c8254f399605",https://www.semanticscholar.org/paper/e00763ecee94bf83523e13a22486c8254f399605,true,true,,A7Ar1IAXUk4swMzT
[1],"- [1] D. Edmondson, E. Olson. A gene with homology to the myc similarity region of MyoD1 is expressed during myogenesis and is sufficient to activate the muscle differentiation program.. n.d.. Citations: 111. https://www.semanticscholar.org/paper/e00763ecee94bf83523e13a22486c8254f399605",https://www.semanticscholar.org/paper/e00763ecee94bf83523e13a22486c8254f399605,true,true,,A7Ar1IAXUk4swMzT
[2],"- [2] Tomohiko Akiyama, Saeko Sato, Nana Chikazawa-Nohtomi, Atsumi Soma, Hiromi Kimura, Shunichi Wakabayashi et al.. Efficient differentiation of human pluripotent stem cells into skeletal muscle cells by combining RNA-based MYOD1-expression and POU5F1-silencing. n.d.. Citations: 31. https://www.semanticscholar.org/paper/411555159973ae042bec05bd8b51cea2c33ad51e",https://www.semanticscholar.org/paper/411555159973ae042bec05bd8b51cea2c33ad51e,true,true,,X9XlQVr8_3geaCns
[4],"- [4] Linh Vo, M. Schmidtke, N. T. da Rosa-Junior, Mindong Ren, M. Schlame, M. Greenberg. Cardiolipin metabolism regulates expression of muscle transcription factor MyoD1 and muscle development. n.d.. Citations: 12. https://www.semanticscholar.org/paper/0cff86b5fc7937caa0120bf23792a61d1b02d08e",https://www.semanticscholar.org/paper/0cff86b5fc7937caa0120bf23792a61d1b02d08e,true,true,,iyPpBEXVyL-7hw4C
[6],"- [6] A. Tanaka, K. Woltjen, K. Miyake, A. Hotta, M. Ikeya, Takuya Yamamoto et al.. Efficient and Reproducible Myogenic Differentiation from Human iPS Cells: Prospects for Modeling Miyoshi Myopathy In Vitro. n.d.. Citations: 214. https://www.semanticscholar.org/paper/d319a1ebaa4a67a47ad0671e169afad06c2b43db",https://www.semanticscholar.org/paper/d319a1ebaa4a67a47ad0671e169afad06c2b43db,true,true,,NG8dqXb_5E9vUWBQ
[9],"- [9] B. Gellhaus, K. Böker, M. Gsaenger, Eyck Rodenwaldt, Marc A. Hüser, A. Schilling et al.. Foxo3 Knockdown Mediates Decline of Myod1 and Myog Reducing Myoblast Conversion to Myotubes. n.d.. Citations: 12. https://www.semanticscholar.org/paper/de5166102fe8683817ffee0b7d7b9fd2aeae2b17",https://www.semanticscholar.org/paper/de5166102fe8683817ffee0b7d7b9fd2aeae2b17,true,true,,qn7myZjd-yd0eTMH
[3],"- [3] Fei Wu, Yannan Qin, Q. Jiang, Jin-yan Zhang, Fang Li, Qian Li et al.. MyoD1 suppresses cell migration and invasion by inhibiting FUT4 transcription in human gastric cancer cells. n.d.. Citations: 15. https://www.semanticscholar.org/paper/3bdb0b87a0f3dd9b6459ba0cf9691b2097829877",https://www.semanticscholar.org/paper/3bdb0b87a0f3dd9b6459ba0cf9691b2097829877,true,true,,VQOQfbm2T3vYervl
[8],"- [8] Di Zhou, Yan Wang, Rong Yang, Fuwei Wang, Zhonghai Zhao, Xin Wang et al.. The MyoD1 Promoted Muscle Differentiation and Generation by Activating CCND2 in Guanling Cattle. n.d.. Citations: 17. https://www.semanticscholar.org/paper/72f992f868374eb2ba91306d87b838a8385addbd",https://www.semanticscholar.org/paper/72f992f868374eb2ba91306d87b838a8385addbd,true,true,,2Sp2U7jokLqYCGsK
[5],"- [5] A. Brunetti, I. Goldfine. Role of myogenin in myoblast differentiation and its regulation by fibroblast growth factor.. n.d.. Citations: 188. https://www.semanticscholar.org/paper/feb6bf1a0f846d2bf898444951dfdf2865eb7283",https://www.semanticscholar.org/paper/feb6bf1a0f846d2bf898444951dfdf2865eb7283,true,true,,oab7_V9rIgHULlUz
