Gene,Summary,PMID,References,Note
SOX9,"Core role: SOX9 specifies astrocytes [1-3]. Core role: SOX9 marks astrocytic cells and functions as a pan-astrocytic marker [4,5]. For example, Sox9 specifies astrocytes and is upregulated after injury [1]. Injury-induced Sox9 phosphorylation increases Sox9 nuclear activity to upregulate Hk1 and astrocytic glycolysis [1]. Excess lactate lactylates H3K9 and drives pro-inflammatory, neurotoxic astrocyte states causing neuropathic pain [1]. Additionally, SOX9 marks astrocytic cells in IDH1‑mutant grade II oligodendrogliomas and astrocytomas [4]. SOX9+ cells form a population largely distinct from OLIG1+ cells and coexpress APOE, CRYAB, ID4, and KCNN3 with elevated BMP, NOTCH, and MAPK signaling [4]. Moreover, in the studied regions, cells labeled with the pan-astrocytic marker SOX9 were all positive for Rab6A [5]. Rab6A/SOX9 double staining would confirm SOX9 as a pan-astrocytic marker and would support Rab6A as a pan-astrocytic marker [5]. In neural progenitor cells, Sox9 promotes astrocyte and oligodendrocyte differentiation and suppresses neuronal differentiation [2]. Sox9 is required for Zbtb20-driven astrocytogenesis [2]. In embryonic spinal cord, Sox9 with NFIA specifies astrocytes and Sox9 loss impairs glial specification [2]. Finally, SOX9, together with nuclear factor I-A and Notch signaling, mediates astrocyte differentiation [3].","41271638
27000654
40427508
33925547
33466322","[1] Chen, Y., Liao, Y., Zhu, H., Wu, Z., Wan, Y., Feng, X., Fan, C., Zhan, D., Cai, H., Cheung, M., Cheung, C. W., & Liu, J. A. (2025). Sox9 regulation of hexokinase 1 controls neuroinflammatory astrocyte subtypes in a rat model of neuropathic pain. <i>Nat Commun</i>, 16(1), 10249. https://doi.org/10.1038/s41467-025-65092-5
[2] Nagao, M., Ogata, T., Sawada, Y., & Gotoh, Y. (2016). Zbtb20 promotes astrocytogenesis during neocortical development. <i>Nat Commun</i>, 7, 11102. https://doi.org/10.1038/ncomms11102
[3] Vellucci, L., Mazza, B., Barone, A., Nasti, A., De Simone, G., Iasevoli, F., & de Bartolomeis, A. (2025). The Role of Astrocytes in the Molecular Pathophysiology of Schizophrenia: Between Neurodevelopment and Neurodegeneration. <i>Biomolecules</i>, 15(5), 615. https://doi.org/10.3390/biom15050615
[4] Augustus, M., Pineau, D., Aimond, F., Azar, S., Lecca, D., Scamps, F., Muxel, S., Darlix, A., Ritchie, W., Gozé, C., Rigau, V., Duffau, H., & Hugnot, J. P. (2021). Identification of CRYAB<sup>+</sup> KCNN3<sup>+</sup> SOX9<sup>+</sup> Astrocyte-Like and EGFR<sup>+</sup> PDGFRA<sup>+</sup> OLIG1<sup>+</sup> Oligodendrocyte-Like Tumoral Cells in Diffuse IDH1-Mutant Gliomas and Implication of NOTCH1 Signalling in Their Genesis. <i>Cancers (Basel)</i>, 13(9), 2107. https://doi.org/10.3390/cancers13092107
[5] Melzer, L., Freiman, T. M., & Derouiche, A. (2021). Rab6A as a Pan-Astrocytic Marker in Mouse and Human Brain, and Comparison with Other Glial Markers (GFAP, GS, Aldh1L1, SOX9). <i>Cells</i>, 10(1), E72. https://doi.org/10.3390/cells10010072
",
