Gene,Summary,PMID,References,Note
OLIG2,"OLIG2 specifies neural progenitors into oligodendrocyte progenitor cells and the oligodendroglial lineage [1-4]. OLIG2 promotes OPC differentiation into myelin-forming oligodendrocytes and supports myelination [1,3,4]. OLIG2 is required for oligodendrocyte development [2,4]. With partial Shh inhibition, Olig2 overexpression in human iPSCs drove oligodendroglial specification by upregulating oligodendroglial markers and increasing NG2+ cells [1]. In tMCAO rats, transplanted Olig2-OPCs partly differentiated into MBP+ oligodendrocytes and engrafted better [1]. The transplanted cells promoted myelination and improved cognition [1]. OLIG2 is required for oligodendrocyte development and binds coding and lncRNA genes [2]. OLIG2 can activate or repress lncRNAs and represses lnc-OPC in neural stem cells [2]. Olig2 knockout prevents oligodendroglial lineage and Olig2 overexpression promotes OPC and oligodendrocyte generation [2]. Olig2 is a bHLH transcription factor expressed in neural progenitors that specifies them into motor neurons and OPCs [3]. Olig2 primes OPCs for differentiation into myelin-forming oligodendrocytes [3]. Olig2-E1 physically interacts with OLIG2 in oligodendrocytes and CRISPRi silencing of Olig2-E1 downregulated Olig2 [3]. Olig2 is a key transcription factor in oligodendrocyte differentiation [4]. Olig2+ cells are specified in the preoptic area and initially coexpress Sox2 [4]. Olig2+ cells then colocalize with sox10 and express mbpa while ensheathing the optic nerve [4]. Mesencephalic olig2/sox10 oligodendrocytes differentiate earlier [4]. In Opalin cKO mice, the percentage of CC1+ mature oligodendrocytes among Olig2+ cells in the corpus callosum was reduced [5]. In Opalin icKO mice, the ratio of CC1+/Olig2+ cells to Olig2+ cells in the corpus callosum was significantly decreased [5].","35547747
34172044
36193754
36477827
39083419","[1] Xu, J., Zhao, J., Wang, R., Zhang, Y., Shen, L., Xiao, Q., Xie, Y., Jiang, J., Nie, Y., & Deng, W. (2022). Shh and Olig2 sequentially regulate oligodendrocyte differentiation from hiPSCs for the treatment of ischemic stroke. <i>Theranostics</i>, 12(7), 3131-3149. https://doi.org/10.7150/thno.69217
[2] Wei, H., Dong, X., You, Y., Hai, B., Duran, R. C., Wu, X., Kharas, N., & Wu, J. Q. (2021). OLIG2 regulates lncRNAs and its own expression during oligodendrocyte lineage formation. <i>BMC Biol</i>, 19(1), 132. https://doi.org/10.1186/s12915-021-01057-6
[3] Fan, C., Kim, D., An, H., & Park, Y. (2023). Identifying an oligodendrocyte enhancer that regulates Olig2 expression. <i>Hum Mol Genet</i>, 32(5), 835-846. https://doi.org/10.1093/hmg/ddac249
[4] Santos-Ledo, A., Pérez-Montes, C., DeOliveira-Mello, L., Arévalo, R., & Velasco, A. (2023). Oligodendrocyte origin and development in the zebrafish visual system. <i>J Comp Neurol</i>, 531(4), 515-527. https://doi.org/10.1002/cne.25440
[5] Teng, X. Y., Hu, P., Zhang, C. M., Zhang, Q. X., Yang, G., Zang, Y. Y., Liu, Z. X., Chen, G., & Shi, Y. S. (2024). OPALIN is an LGI1 receptor promoting oligodendrocyte differentiation. <i>Proc Natl Acad Sci U S A</i>, 121(32), e2403652121. https://doi.org/10.1073/pnas.2403652121
",
