text,jr_score,summary
"The basic leucine zipper transcription factor CCAAT/enhancer binding protein alpha ( CEBPA ) codes for a critical regulator during neutrophil differentiation. Aberrant expression or function of this protein contributes to the development of acute myeloid leukemia (AML). In this study, we identified two novel unrelated CEBPA target genes, the glycolytic enzyme hexokinase 3 ( HK3 ) and the krüppel-like factor 5 ( KLF5 ) transcription factor, by comparing gene profiles in two cohorts of CEBPA wild-type and mutant AML patients. In addition, we found CEBPA-dependent activation of HK3 and KLF5 transcription during all- trans retinoic acid (ATRA) mediated neutrophil differentiation of acute promyelocytic leukemia (APL) cells. Moreover, we observed direct regulation of HK3 by CEBPA, whereas our data suggest an indirect regulation of KLF5 by this transcription factor. Altogether, our data provide an explanation for low HK3 and KLF5 expression in particular AML subtype and establish these genes as novel CEBPA targets during neutrophil differentiation.

The CCAAT/enhancer binding protein alpha ( CEBPA ) is a master regulator of myeloid differentiation that drives hematopoiesis towards the granulocytic lineage 1 . The relevance of CEBPA in the maintenance of myeloid lineage is underlined by the fact that Cebpa-null mice lack the production of neutrophils and eosinophils 2 . Not surprisingly, CEBPA functions are frequently disrupted in particular subtypes of acute myeloid leukemias (AML), thereby contributing to the differentiation arrest seen in AML blast cells. Several groups reported aberrant CEBPA function due to intragenetic mutations in 5–10% of AML patients (10–19% in normal karyotype-AML) (Reviewed in 3 , 4 , 5 , 6 ). Mutations in the CEBPA gene predominantly cause either a frame-shift at the N-terminus resulting in the truncated CEBPA isoform p30 with dominant negative function, or disrupt the basic zipper region at the C-terminus causing weakened DNA-binding (Reviewed in 7 , 8 ). Furthermore, most AML patients harbor CEBPA mutations on both alleles and these bi-allelic CEBPA mutated patients have a favorable clinical outcome as compared to CEBPA -wild-type or patients with a mono-allelic mutation (Reviewed in 5 , 6 ). Lastly, transcriptional repression mediated by leukemic fusion proteins or epigenetic alterations such as aberrant promoter hypermethylation further leads to low CEBPA expression in some AML patients 9 .

Our group recently reported a functional role for hexokinase 3 ( HK3 ) and Krüppel-like factor 5 ( KLF5 ) in the pathogenesis of AML 10 , 11 . HK3 (ATP:D-hexose 6-phosphotransferase) is a glycolytic enzyme most frequently expressed in myeloid cells and represents the dominant hexokinase in granulocytes accounting for 70–80% of total hexokinase activity 10 , 12 . We identified HK3 as a direct target of the transcription factors PU.1 and oncogenic fusion protein PML-RARA in acute promyelocytic leukemia (APL) characterized by the t(15;17) translocation. Inhibition of HK3 impairs neutrophil differentiation of APL cells and promotes cell death upon anthracycline treatment. We found significantly reduced HK3 expression not only in APL but also in other AML subtypes suggesting that additional mechanisms responsible for low HK3 levels in AML are operative 10 .

We and others found that members of the Krüppel-like factor (KLF) family are often deregulated in primary AML patient samples 11 . The KLF transcription factor family is composed of 17 members involved in diverse functions such as proliferation, self-renewal, differentiation and apoptosis 13 . Among the different KLFs inhibited in AML, KLF5 was found to be essential for granulocytic differentiation 11 , 14 . Low KLF5 expression in AML can partially be explained by hypermethylation of its promoter as shown in primary AML and in several AML cell line models 14 . Still unclear is how KLF5 is transcriptionally regulated during granulocytic differentiation.

In this study we describe two novel CEBPA target genes, the glycolytic enzyme HK3 and the transcription factor KLF5 , both of which are significantly downregulated in CEBPA -mutated AML patients.

CEBPA is a master regulator of myeloid differentiation, whose expression peaks in the granulocyte-monocyte progenitor cell stage, and diminishes during terminal granulocyte differentiation 3 . Most importantly, in different AML subtypes CEBPA expression or function is inhibited by a variety of mechanisms 3 , 5 , 6 . In an attempt to test whether HK3 and KLF5, two genes with a recently discovered role in APL differentiation 10 , 11 , 14 , are novel CEBPA target genes, we compared their expression in a total of 90 CEBPA -mutated or CEBPA wild-type AML patients. HK3 and KLF5 were below the detection limit in 11 and 16 AML patient samples, respectively. We compared HK3 mRNA expression in CD34 + samples (n = 4) to 74 CEBPA -wt and 5 CEBPA -mutated AML samples. KLF5 expression in 4 CD34 + samples was compared to 70 CEBPA -wt and 4 CEBPA -mutated AML samples. A detailed analysis of HK3 and KLF5 mRNA levels in primary AML (FAB M0-M7) patient samples revealed a significantly lower expression of HK3 and KLF5 in CEBPA -mutated as compared to CEBPA wild-type AML samples (p < 0.01) ( Figure 1a–b ). As seen for other CEBPA target genes identified by screening AML patient cohorts, our results suggest that disrupting CEBPA function impairs HK3 and KLF5 expression 15 . Next, we confirmed that HK3 and KLF5 expression is significantly lower in CEBPA-mutated, but not CEBPA wild-type patients from analysis of a second AML patient cohort (n = 154). Since these cohorts contained patients with CEBPA single (SM) or double mutations (DM), we could address whether single or double mutations alter HK3 or KLF5 expression 16 . We found that HK3 or KLF5 expression was not significantly different from patient's samples with either CEBPA SM or DM ( Figure 1c–d ). Taken together, our findings indicate that loss of HK3 or KLF5 expression correlated with CEBPA mutations, irrespective of single or double CEBPA mutations, whereas enhanced expression of HK3 or KLF5 correlated with wild-type CEBPA expression.

To experimentally test whether loss of CEBPA mRNA alters HK3 and KLF5 expression, we knocked down CEBPA in the two APL cell line models NB4 and HT93. This was accomplished using lentiviral vectors expressing two independent short hairpin (sh)RNAs targeting the CEBPA gene. Knockdown efficiency was evaluated by qPCR and Western blotting ( Figures 2a, e and f ). After 4 days of treatment with 1 μM ATRA to promote neutrophil differentiation, we observed significantly reduced HK3 and KLF5 mRNA levels in the NB4 and HT93 CEBPA knockdown cell lines as compared to the control cells ( Figures 2b and c ). We evaluated G-CSFR expression in CEBPA knockdown cells ( Figure 2d ) to validate inhibition of ATRA-induced neutrophil differentiation, while induction of CEBPE , a direct CEBPA regulated gene 17 , was measured as an additional control ( Supplementary Figures S1a and b ). Our results clearly demonstrate that the upregulation of HK3 and KLF5 during neutrophil differentiation of APL cells is CEBPA -dependent.

Our findings prompted us to investigate if HK3 and KLF5 are direct transcriptional targets of CEBPA. To this end, we first analyzed the genomic regions surrounding exon 1 of these genes for putative CEBPA binding sites using Matinspector 8.0. We identified two putative CEBPA binding sites in both the HK3 and the KLF5 genomic regions analyzed ( Figure 3a and c ). Chromatin immunoprecipitation (ChIP) revealed binding of CEBPA at positions +821/+2963 and −385/−1576 relative to the transcriptional start site on the HK3 and KLF5 genomic regions, respectively ( Figures 3b and d ). We next asked whether CEBPA activates HK3 and KLF5 transcription from these sites using promoter reporter assays. CEBPA co-expression with the different luciferase promoter reporters resulted in a significant, dose-dependent activation of HK3 promoter A (up to 37-fold) and KLF5 (up to 11-fold) transcription, respectively ( Figures 3e and g ). The HK3 promoter B containing the CEBPA binding site +2963 was only induced 1.5-fold ( Supplementary Figure S2a ). To confirm the specific CEBPA-induction of the promoter activity we mutated the CEBPA binding sites on the HK3 promoter A and the KLF5 promoter. Indeed, inactivating the CEBPA binding site in the HK3 promoter significantly inhibited transcriptional inhibition ( Figure 3f ). Surprisingly, however, introducing single or double CEBPA binding sites mutations in the KLF5 promoter did not attenuate transcriptional activity of the reporter construct ( Supplementary Figure S2b ).

To confirm CEBPA-dependent transcriptional regulation of HK3 and KLF5, we overexpressed CEBPA in HT93 APL cells by transiently transfecting a CEBPA expression plasmid. Ectopic expression of CEBPA in HT93 cells resulted in a significant 5.5- and 12.3-fold induction of HK3 and KLF5 gene expression, respectively ( Figures 4a and b ). CEBPA transfection efficiency was assessed by qPCR and Western blotting ( Figure 4d and e ). In addition, induction of the direct CEBPA target CEBPE was measured as a positive control of CEBPA activity ( Figure 4c ). Next, we used K562 leukemic cell lines expressing 4-OHT inducible full-length CEBPA (CEBPA-p42-estrogen receptor (ER)), a truncated isoform (CEBPA-p30-ER), or a p42 isoform with a mutation preventing interaction with E2F and neutrophil differentiation (CEBPA-BRM2-ER). After 24 h of 4-OHT treatment, we observed a significant 2.5-fold transcriptional activation of KLF5 (p < 0.05) upon CEBPA-p42-ER activation only, but not in ER control, nor in CEBPA-p30-ER, or mutated CEBPA-BRM2-ER activated K562 cells ( Figure 4f ), suggesting that induction of KLF5 is a specific function of the full length CEBPA p42 isoform. Interestingly, HK3 mRNA was not detectable in K562 cells indicating that different HK isoforms may be active in these cells. Induction of CEBPE was measured as a positive control ( Figure 4g ). Altogether, our findings demonstrate that CEBPA is a crucial positive regulator of HK3 and KLF5 during granulocytic differentiation.

Reduced CEBPA expression or loss of function mutations are commonly observed in AML suggesting that the deregulation of CEBPA function is a major event in the development of AML 18 , 19 , 20 . Identifying new CEBPA target genes and associated CEBPA-dependent pathways in myeloid differentiation may provide novel insights into the differentiation block as well as into ancillary cellular functions found in AML. Interestingly, CEBPA has been described as a pivotal regulator of various metabolic processes in different cell types 21 . Nevertheless, whether CEBPA regulates metabolic activity in myeloid cells is of yet unclear. Our findings now link CEBPA to glycolysis via direct positive regulation of the glycolytic enzyme HK3 . We have previously shown that HK3 expression is repressed in AML, particularly in APL, where low HK3 levels are the result of PML-RARA repression and low expression of its positive regulator PU.1 10 . Our results demonstrate that CEBPA is an additional critical regulator of HK3 expression in AML and during neutrophil differentiation of APL cells. Furthermore, our findings show that the lowest HK3 expression is found in CEBPA mutated patients and may contribute to the differentiation block in this AML subtype.

In general, AML is defined by a block in differentiation and an increased proliferation of immature myeloid progenitors 18 . Additionally, loss of CEBPA-mediated cell-cycle arrest is crucial for the development of AML 15 , 22 , 23 . Since KLF5 regulates genes involved in cell cycle regulation and apoptosis, it may represent a relevant downstream effector of CEBPA-induced cell cycle arrest (reviewed in 24 ). In the myeloid lineage, KLF5 induces differentiation and functions as a tumor suppressor and its low expression in AML is partially explained by epigenetic silencing 11 , 14 , 25 . Importantly, low KLF5 expression is associated with poor overall survival 26 . In this study, we suggest an additional mechanism for low KLF5 levels in AML that is loss of positive regulation of KLF5 due to impaired CEBPA function. Since mutating the CEBPA binding sites in the KLF5 promoter constructs did not change the responsiveness of these reporters to CEBPA expression, CEBPA may indirectly activate KLF5 transcription. The KLF5 promoter lacks a TATA box, but contains a GC-rich region that is activated by the transcription factor Sp1 27 . Moreover, CEBPA can functionally interact with Sp1, e.g. in regulating the CD11c integrin gene 28 . We propose, that CEBPA induces KLF5 transcription, similarly to CD11c regulation, via Sp1.

In conclusion, we identified HK3 and KLF5 as novel CEBPA-regulated genes in AML and during APL differentiation underlining their tumor suppressor function in AML as well as their role in granulopoiesis.",,"Relationship structure: causal chain.

CEBPA is a master regulator that drives hematopoiesis toward the granulocytic (neutrophil) lineage (Cebpa‑null mice lack neutrophils/eosinophils). In APL cell models and AML patient samples, CEBPA positively regulates two genes during ATRA‑mediated neutrophil differentiation: it directly binds and activates HK3 transcription (ChIP and promoter mutational evidence), and it activates KLF5 in a CEBPA‑dependent but likely indirect manner (ChIP binding observed, promoter mutations did not abolish reporter responsiveness; induction requires the full‑length p42 isoform). Loss of CEBPA expression or CEBPA mutations in AML correlate with reduced HK3 and KLF5 expression, associating impaired CEBPA function with defective granulocytic differentiation."
